{
  "schema_version": 1,
  "contract_sha256": "6e256b9f8b2ed0e7243acc96d96daa854410673f59334b126446666d488ffe92",
  "execution_plan_sha256": "54d792571e20239e7b586360fe04557154fc64a5942865896c35d34b89584101",
  "execution_id": "layer5a-v2-first-execution",
  "overall_status": "CANONICAL_BLOCKED",
  "authority": "ENGINE_GATE_AUTHORITY",
  "counters": {
    "total_required": 39,
    "executed": 29,
    "passed": 28,
    "blocked": 1,
    "failed": 0,
    "not_run_or_locked": 10,
    "engine_required": 27,
    "engine_executed": 27,
    "engine_passed": 27,
    "canonical_required": 12,
    "canonical_executed": 2,
    "canonical_passed": 1
  },
  "promotion": {
    "engine_gate": "PASS",
    "counterterm_compiler": "BLOCKED",
    "layer6_authorized": false
  },
  "preserved_dispositions": {
    "gauge_matching": "DIRECT_GAUGE_MATCHING_UNRESOLVED",
    "bfb": "BFB_UNRESOLVED",
    "finite_C1_GS": null
  },
  "tests": [
    {
      "test_id": "UVP_P01",
      "global_ordinal": 1,
      "phase": "ENGINE_5A",
      "family": "PRIMITIVE",
      "status": "PASS",
      "authorization": "TERMINAL",
      "attempt": 1,
      "primary": {
        "state": "COMPLETE",
        "method": "large_loop_momentum_radial_UV_projection_with_auxiliary_mass",
        "inventory_sha256": null,
        "residue_sha256": "3a7ca69ddc77b722f2bf4f38d71ffde20498061a8c4b181b4e88a269d19c33f8",
        "uv_ir_provenance_sha256": "ad6646b107c543a2439d73be2522a0db6ab38a2774ca3c43213a44c639a749fa"
      },
      "replay": {
        "state": "COMPLETE",
        "method": "independent_Wick_rotation_and_Gamma_function_residue",
        "inventory_sha256": null,
        "residue_sha256": "3405590993437058d2c377b505babb99ea303ce3069c5e8ce0de326dfacae237",
        "uv_ir_provenance_sha256": "ad6646b107c543a2439d73be2522a0db6ab38a2774ca3c43213a44c639a749fa"
      },
      "derived_result": {
        "normalized_residue": "-m2",
        "pole_unit": "1/(16*pi^2*epsilon_bar)",
        "pole_expression": "-m2/(16*pi^2*epsilon_bar)",
        "primary_minus_replay": "0",
        "evidence_sha256": "7d9a646003c1a46a1bc693289c91ea1d7bea844f05dabe3e8a5b06d2bce1f071"
      },
      "verdict_reason": "primary_auxiliary_mass_UV_projection_equals_independent_Gamma_function_replay_exactly_in_frozen_convention",
      "evidence_files": [
        "uvp_p01_primary.json",
        "uvp_p01_independent_replay.json",
        "uvp_p01_uv_ir_provenance.json",
        "uvp_p01_evidence.json"
      ]
    },
    {
      "test_id": "UVP_P02",
      "global_ordinal": 2,
      "phase": "ENGINE_5A",
      "family": "PRIMITIVE",
      "status": "PASS",
      "authorization": "TERMINAL",
      "attempt": 1,
      "primary": {
        "state": "COMPLETE",
        "method": "radial_large_loop_momentum_logarithmic_UV_projector",
        "inventory_sha256": null,
        "residue_sha256": "66d293fd5bd34a6c405fc3db797354b8f793bcc0e126f05920cfc520ad5ecc79",
        "uv_ir_provenance_sha256": "79c637dbbdd2e5f4174c806e0a7ad189eb762ba5cbf8c6f97677addc3ecbd75f"
      },
      "replay": {
        "state": "COMPLETE",
        "method": "independent_Wick_rotation_and_two_propagator_Gamma_function_residue",
        "inventory_sha256": null,
        "residue_sha256": "42a39389d4c2ae6b7b5cc133b961d5e33771dd1c981e106640f35fab8f25f6ec",
        "uv_ir_provenance_sha256": "79c637dbbdd2e5f4174c806e0a7ad189eb762ba5cbf8c6f97677addc3ecbd75f"
      },
      "derived_result": {
        "normalized_residue": "1",
        "mass_derivative_of_residue": "0",
        "pole_unit": "1/(16*pi^2*epsilon_bar)",
        "pole_expression": "1/(16*pi^2*epsilon_bar)",
        "primary_minus_replay": "0",
        "evidence_sha256": "549ce62f87a6c73bd0fbc60871a50de4d6ec8952fb92ca58adb2f5f45fee1013"
      },
      "verdict_reason": "primary_mass_independent_log_UV_projector_equals_independent_two_propagator_Gamma_function_replay_exactly",
      "evidence_files": [
        "uvp_p02_primary.json",
        "uvp_p02_independent_replay.json",
        "uvp_p02_uv_ir_provenance.json",
        "uvp_p02_evidence.json"
      ]
    },
    {
      "test_id": "UVP_P03",
      "global_ordinal": 3,
      "phase": "ENGINE_5A",
      "family": "PRIMITIVE",
      "status": "PASS",
      "authorization": "TERMINAL",
      "attempt": 1,
      "primary": {
        "state": "COMPLETE",
        "method": "direct_auxiliary_mass_doubled_line_UV_projection",
        "inventory_sha256": null,
        "residue_sha256": "f01b82a7925f20aa7854b40412af3c3a84140e8a2d5835d9a2e13194205ae132",
        "uv_ir_provenance_sha256": "e7650fcdb9ff758bcd1ffd852697ef45b364ddc6fa3a127c0022b5895f3d21da"
      },
      "replay": {
        "state": "COMPLETE",
        "method": "independent_general_alpha_Gamma_function_replay",
        "inventory_sha256": null,
        "residue_sha256": "e93f071293a2047d950edb98c5a17f733795bb0d624439458384e93aad05190a",
        "uv_ir_provenance_sha256": "e7650fcdb9ff758bcd1ffd852697ef45b364ddc6fa3a127c0022b5895f3d21da"
      },
      "derived_result": {
        "normalized_residue": "1",
        "pole_unit": "1/(16*pi^2*epsilon_bar)",
        "pole_expression": "1/(16*pi^2*epsilon_bar)",
        "primary_minus_replay": "0",
        "primary_minus_p01_derivative": "0",
        "replay_minus_p01_derivative": "0",
        "p01_evidence_sha256": "7d9a646003c1a46a1bc693289c91ea1d7bea844f05dabe3e8a5b06d2bce1f071",
        "derivative_relation_sha256": "834d23375b7a6126dab4141c8f1bb9d331a22b14b1115de04278a3da102ddf9c",
        "evidence_sha256": "be4585b1188f61116490d810c9d66ad2f391963d05a01d69ca7233ccd849b4d2"
      },
      "verdict_reason": "direct_doubled_line_projection_equals_independent_Gamma_replay_and_minus_mass_derivative_of_frozen_P01_pole_exactly",
      "evidence_files": [
        "uvp_p03_primary.json",
        "uvp_p03_independent_replay.json",
        "uvp_p03_p01_derivative_relation.json",
        "uvp_p03_uv_ir_provenance.json",
        "uvp_p03_evidence.json"
      ]
    },
    {
      "test_id": "UVP_P04",
      "global_ordinal": 4,
      "phase": "ENGINE_5A",
      "family": "PRIMITIVE",
      "status": "PASS",
      "authorization": "TERMINAL",
      "attempt": 1,
      "primary": {
        "state": "COMPLETE",
        "method": "d_dimensional_rotational_tensor_reducer_with_radial_UV_projector",
        "inventory_sha256": null,
        "residue_sha256": "097b96f20361d393b166b7a51c96167d999d8d798dcce508f497eaadbcedf441",
        "uv_ir_provenance_sha256": "a0cc08644785913c282bb23120d1fabb9cb0809b3e5848f289d9da1bb5a9de9e"
      },
      "replay": {
        "state": "COMPLETE",
        "method": "independent_Schwinger_parameter_Gaussian_source_replay",
        "inventory_sha256": null,
        "residue_sha256": "c8890ce8597309156871823239b7dc89e6366d9d8e042a4cfce7b55357d3a7a9",
        "uv_ir_provenance_sha256": "a0cc08644785913c282bb23120d1fabb9cb0809b3e5848f289d9da1bb5a9de9e"
      },
      "derived_result": {
        "normalized_tensor_residue_coefficient": "-m2/2",
        "tensor_structure": "delta_mu_nu",
        "pole_unit": "1/(16*pi^2*epsilon_bar)",
        "tensor_pole_expression": "delta_mu_nu*(-m2/2)/(16*pi^2*epsilon_bar)",
        "primary_minus_replay": "0",
        "maximum_contraction_residual": "0",
        "premature_d4_missed_finite_shift": "-m2/4",
        "evidence_sha256": "8c848af052e922838a0329c717d89c24a38fc97e740b39151689e3eec8df4326"
      },
      "verdict_reason": "primary_d_dimensional_tensor_reduction_equals_independent_Schwinger_Gaussian_replay_with_exact_contraction_and_d4_adversarial_checks",
      "evidence_files": [
        "uvp_p04_primary.json",
        "uvp_p04_independent_replay.json",
        "uvp_p04_uv_ir_provenance.json",
        "uvp_p04_evidence.json"
      ]
    },
    {
      "test_id": "UVP_P05",
      "global_ordinal": 5,
      "phase": "ENGINE_5A",
      "family": "PRIMITIVE",
      "status": "PASS",
      "authorization": "TERMINAL",
      "attempt": 1,
      "primary": {
        "state": "COMPLETE",
        "method": "recursive_perfect_matching_d_dimensional_tensor_reducer",
        "inventory_sha256": null,
        "residue_sha256": "0be759a316e1ed344775a103fcdb78033777e38ebcc1e34cc561b4e49ba9a48f",
        "uv_ir_provenance_sha256": "6ff0aa6a02a9ed779406ffeffb1dd65cbc974b7aec7b8087e1afd342a410c627"
      },
      "replay": {
        "state": "COMPLETE",
        "method": "independent_Gaussian_moments_with_permutation_orbit_pairings",
        "inventory_sha256": null,
        "residue_sha256": "0d2b91a0a4e46f103d8595a60fd77c4b456a0bd373a92322457bf553cbb8beda",
        "uv_ir_provenance_sha256": "6ff0aa6a02a9ed779406ffeffb1dd65cbc974b7aec7b8087e1afd342a410c627"
      },
      "derived_result": {
        "rank4_pairing_count": 3,
        "rank6_pairing_count": 15,
        "rank4_normalized_residue_per_pairing": "1/24",
        "rank6_normalized_residue_per_pairing": "1/192",
        "maximum_pairing_or_contraction_residual": "0",
        "rank4_premature_d4_missed_finite_shift": "5/144",
        "rank6_premature_d4_missed_finite_shift": "13/2304",
        "evidence_sha256": "a2c8154d9d38d8d24fcf85f25b202bc7ea3c0ca7c45f34dd591c17990cda01da"
      },
      "verdict_reason": "recursive_primary_and_permutation_orbit_Gaussian_replay_agree_on_all_rank4_rank6_pairings_coefficients_symmetries_and_recursive_contractions",
      "evidence_files": [
        "uvp_p05_primary.json",
        "uvp_p05_independent_replay.json",
        "uvp_p05_uv_ir_provenance.json",
        "uvp_p05_evidence.json"
      ]
    },
    {
      "test_id": "UVP_P06",
      "global_ordinal": 6,
      "phase": "ENGINE_5A",
      "family": "PRIMITIVE",
      "status": "PASS",
      "authorization": "TERMINAL",
      "attempt": 1,
      "primary": {
        "state": "COMPLETE",
        "method": "integrand_level_local_Taylor_expansion_with_d_tensor_reduction",
        "inventory_sha256": null,
        "residue_sha256": "f7373d0e633dd747a4d1b283454f077484fa9456facc331f11adf398a2199fdf",